{
  "$schema": "https://github.com/OpenSynaptic/OpenSynaptic-Conformance/blob/main/schemas/report.schema.json",
  "kind": "conformance-report",
  "schemaVersion": "1.0.0",
  "reportId": "mock-run-profile-20260415T140752Z",
  "createdAt": "2026-04-15T14:07:52.725799Z",
  "repositoryVersion": "0b6bf0b",
  "profileId": "opensynaptic.l4-security-validated",
  "datasetVersion": "1.0.0",
  "implementation": {
    "name": "OpenSynaptic Mock Adapter",
    "version": "1.0.0",
    "adapter": "opensynaptic-mock",
    "target": "contract-example",
    "commit": "0b6bf0b"
  },
  "environment": {
    "pythonVersion": "3.13.13",
    "runner": "mock-adapter"
  },
  "summary": {
    "total": 13,
    "passed": 13,
    "failed": 0,
    "skipped": 0,
    "status": "PASS",
    "note": "Repository-local synthetic pass used for contract validation."
  },
  "results": [
    {
      "id": "L4-HS-01",
      "status": "PASS",
      "message": "Synthetic contract pass via mock adapter (run-profile).",
      "durationMs": 0.0,
      "details": {
        "adapterMode": "run-profile",
        "source": "repository-mock-adapter"
      }
    },
    {
      "id": "L4-HS-02",
      "status": "PASS",
      "message": "Synthetic contract pass via mock adapter (run-profile).",
      "durationMs": 0.0,
      "details": {
        "adapterMode": "run-profile",
        "source": "repository-mock-adapter"
      }
    },
    {
      "id": "L4-HS-03",
      "status": "PASS",
      "message": "Synthetic contract pass via mock adapter (run-profile).",
      "durationMs": 0.0,
      "details": {
        "adapterMode": "run-profile",
        "source": "repository-mock-adapter"
      }
    },
    {
      "id": "L4-TS-01",
      "status": "PASS",
      "message": "Synthetic contract pass via mock adapter (run-profile).",
      "durationMs": 0.0,
      "details": {
        "adapterMode": "run-profile",
        "source": "repository-mock-adapter"
      }
    },
    {
      "id": "L4-TS-02",
      "status": "PASS",
      "message": "Synthetic contract pass via mock adapter (run-profile).",
      "durationMs": 0.0,
      "details": {
        "adapterMode": "run-profile",
        "source": "repository-mock-adapter"
      }
    },
    {
      "id": "L4-TS-03",
      "status": "PASS",
      "message": "Synthetic contract pass via mock adapter (run-profile).",
      "durationMs": 0.0,
      "details": {
        "adapterMode": "run-profile",
        "source": "repository-mock-adapter"
      }
    },
    {
      "id": "L4-ID-01",
      "status": "PASS",
      "message": "Synthetic contract pass via mock adapter (run-profile).",
      "durationMs": 0.0,
      "details": {
        "adapterMode": "run-profile",
        "source": "repository-mock-adapter"
      }
    },
    {
      "id": "L4-ID-02",
      "status": "PASS",
      "message": "Synthetic contract pass via mock adapter (run-profile).",
      "durationMs": 0.0,
      "details": {
        "adapterMode": "run-profile",
        "source": "repository-mock-adapter"
      }
    },
    {
      "id": "L4-ID-03",
      "status": "PASS",
      "message": "Synthetic contract pass via mock adapter (run-profile).",
      "durationMs": 0.0,
      "details": {
        "adapterMode": "run-profile",
        "source": "repository-mock-adapter"
      }
    },
    {
      "id": "L4-ID-04",
      "status": "PASS",
      "message": "Synthetic contract pass via mock adapter (run-profile).",
      "durationMs": 0.0,
      "details": {
        "adapterMode": "run-profile",
        "source": "repository-mock-adapter"
      }
    },
    {
      "id": "L4-DISP-01",
      "status": "PASS",
      "message": "Synthetic contract pass via mock adapter (run-profile).",
      "durationMs": 0.0,
      "details": {
        "adapterMode": "run-profile",
        "source": "repository-mock-adapter"
      }
    },
    {
      "id": "L4-DISP-02",
      "status": "PASS",
      "message": "Synthetic contract pass via mock adapter (run-profile).",
      "durationMs": 0.0,
      "details": {
        "adapterMode": "run-profile",
        "source": "repository-mock-adapter"
      }
    },
    {
      "id": "L4-DISP-03",
      "status": "PASS",
      "message": "Synthetic contract pass via mock adapter (run-profile).",
      "durationMs": 0.0,
      "details": {
        "adapterMode": "run-profile",
        "source": "repository-mock-adapter"
      }
    }
  ]
}